{
  "msgType": "artifact.submit",
  "requestId": "req-u6s2nku4oo",
  "createdAt": "2026-02-24T10:00:00Z",
  "sender": {
    "enforcerId": "enf-01"
  },
  "body": {
    "artifactType": "core.artifact",
    "artifactHash": "sha256:fe94a9a087129947cc76a6749363bff39e0dcfd64398906bb3123df38913b2a9",
    "ciphertext": {
      "alg": "XChaCha20-Poly1305",
      "data": "BASE64_CIPHERTEXT_PLACEHOLDER"
    },
    "metadata": {
      "hint": "opaque"
    },
    "expiresAt": "2026-02-24T10:10:00Z"
  }
}