{
  "msgId": "msg-87fxyntx85",
  "msgType": "approval.request",
  "requestId": "req-u6s2nku4oo",
  "createdAt": "2026-02-24T10:00:01Z",
  "expiresAt": "2026-02-24T10:10:00Z",
  "sender": {
    "gatewayId": "gw-01"
  },
  "recipient": {
    "approverId": "app-01"
  },
  "body": {
    "artifactType": "core.artifact",
    "artifactHash": "sha256:fe94a9a087129947cc76a6749363bff39e0dcfd64398906bb3123df38913b2a9",
    "ciphertextRef": {
      "kind": "inline",
      "data": "BASE64_CIPHERTEXT_PLACEHOLDER"
    },
    "policyHint": {
      "ui": "Approve or Reject"
    }
  }
}